{
  "schemaVersion": "1.0.0",
  "kind": "vehicle-surface-binding",
  "vehicleId": "sc01",
  "catalogVersion": "sc01-draft-20260121",
  "modelVersion": "sc01-surface-ready-2026-01",
  "capability": "complete",
  "sourceFbx": {
    "path": "fixtures/sc01-surface-ready.fbx",
    "sha256": "eeeeeeeeeeeeeeeeeeeeeeeeeeeeeeeeeeeeeeeeeeeeeeeeeeeeeeeeeeeeeeee",
    "bytes": 1
  },
  "bindings": [
    {"surfaceId":"exterior-body-cover","materialSlotIds":["sc01_exterior_body_cover"],"selectors":[{"targetNode":"ExteriorMesh","sourceMaterialId":"SRC_EXTERIOR_BODY_COVER","faceRanges":["*"]}]},
    {"surfaceId":"engine-bay-cover","materialSlotIds":["sc01_engine_bay_cover"],"selectors":[{"targetNode":"EngineBayMesh","sourceMaterialId":"SRC_ENGINE_BAY_COVER","faceRanges":["*"]}]},
    {"surfaceId":"wheel-material","materialSlotIds":["sc01_wheel_material"],"selectors":[{"targetNode":"WheelMesh","sourceMaterialId":"SRC_WHEEL_MATERIAL","faceRanges":["*"]}]},
    {"surfaceId":"wheel-style","materialSlotIds":["sc01_wheel_style"],"selectors":[{"targetNode":"WheelStyleMesh","sourceMaterialId":"SRC_WHEEL_STYLE","faceRanges":["*"]}]},
    {"surfaceId":"wheel-color","materialSlotIds":["sc01_wheel_color"],"selectors":[{"targetNode":"WheelColorMesh","sourceMaterialId":"SRC_WHEEL_COLOR","faceRanges":["*"]}]},
    {"surfaceId":"front-caliper-color","materialSlotIds":["sc01_front_caliper_color"],"selectors":[{"targetNode":"FrontCaliperMesh","sourceMaterialId":"SRC_FRONT_CALIPER_COLOR","faceRanges":["*"]}]},
    {"surfaceId":"rear-caliper-color","materialSlotIds":["sc01_rear_caliper_color"],"selectors":[{"targetNode":"RearCaliperMesh","sourceMaterialId":"SRC_REAR_CALIPER_COLOR","faceRanges":["*"]}]},
    {"surfaceId":"steering-wheel-skin","materialSlotIds":["sc01_steering_wheel_skin"],"selectors":[{"targetNode":"InteriorMesh","sourceMaterialId":"SRC_STEERING_WHEEL_SKIN","faceRanges":["0:9"]}]},
    {"surfaceId":"steering-wheel-addon","materialSlotIds":["sc01_steering_wheel_addon"],"selectors":[{"targetNode":"InteriorMesh","sourceMaterialId":"SRC_STEERING_WHEEL_ADDON","faceRanges":["10:19"]}]},
    {"surfaceId":"steering-center-mark","materialSlotIds":["sc01_steering_center_mark"],"selectors":[{"targetNode":"InteriorMesh","sourceMaterialId":"SRC_STEERING_CENTER_MARK","faceRanges":["20:29"]}]},
    {"surfaceId":"ip-wings","materialSlotIds":["sc01_ip_wings"],"selectors":[{"targetNode":"InteriorMesh","sourceMaterialId":"SRC_IP_WINGS","faceRanges":["110:119"]}]},
    {"surfaceId":"ip-middle","materialSlotIds":["sc01_ip_middle"],"selectors":[{"targetNode":"InteriorMesh","sourceMaterialId":"SRC_IP_MIDDLE","faceRanges":["120:129"]}]},
    {"surfaceId":"ip-instrument-cover","materialSlotIds":["sc01_ip_instrument_cover"],"selectors":[{"targetNode":"InteriorMesh","sourceMaterialId":"SRC_IP_INSTRUMENT_COVER","faceRanges":["130:139"]}]},
    {"surfaceId":"ip-upper-trim","materialSlotIds":["sc01_ip_upper_trim"],"selectors":[{"targetNode":"InteriorMesh","sourceMaterialId":"SRC_IP_UPPER_TRIM","faceRanges":["140:149"]}]},
    {"surfaceId":"ip-lower-trim","materialSlotIds":["sc01_ip_lower_trim"],"selectors":[{"targetNode":"InteriorMesh","sourceMaterialId":"SRC_IP_LOWER_TRIM","faceRanges":["150:159"]}]},
    {"surfaceId":"ip-center-mark","materialSlotIds":["sc01_ip_center_mark"],"selectors":[{"targetNode":"InteriorMesh","sourceMaterialId":"SRC_IP_CENTER_MARK","faceRanges":["160:169"]}]},
    {"surfaceId":"a-pillar-surface","materialSlotIds":["sc01_a_pillar_surface"],"selectors":[{"targetNode":"InteriorMesh","sourceMaterialId":"SRC_A_PILLAR_SURFACE","faceRanges":["220:229"]}]},
    {"surfaceId":"seat-backrest","materialSlotIds":["sc01_seat_backrest"],"selectors":[{"targetNode":"InteriorMesh","sourceMaterialId":"SRC_SEAT_BACKREST","faceRanges":["30:39"]}]},
    {"surfaceId":"seat-bolster","materialSlotIds":["sc01_seat_bolster"],"selectors":[{"targetNode":"InteriorMesh","sourceMaterialId":"SRC_SEAT_BOLSTER","faceRanges":["40:49"]}]},
    {"surfaceId":"seat-shell-back","materialSlotIds":["sc01_seat_shell_back"],"selectors":[{"targetNode":"InteriorMesh","sourceMaterialId":"SRC_SEAT_SHELL_BACK","faceRanges":["50:59"]}]},
    {"surfaceId":"seat-headrest-mark","materialSlotIds":["sc01_seat_headrest_mark"],"selectors":[{"targetNode":"InteriorMesh","sourceMaterialId":"SRC_SEAT_HEADREST_MARK","faceRanges":["60:69"]}]},
    {"surfaceId":"door-upper","materialSlotIds":["sc01_door_upper"],"selectors":[{"targetNode":"InteriorMesh","sourceMaterialId":"SRC_DOOR_UPPER","faceRanges":["70:79"]}]},
    {"surfaceId":"door-middle","materialSlotIds":["sc01_door_middle"],"selectors":[{"targetNode":"InteriorMesh","sourceMaterialId":"SRC_DOOR_MIDDLE","faceRanges":["80:89"]}]},
    {"surfaceId":"door-armrest","materialSlotIds":["sc01_door_armrest"],"selectors":[{"targetNode":"InteriorMesh","sourceMaterialId":"SRC_DOOR_ARMREST","faceRanges":["90:99"]}]},
    {"surfaceId":"door-armrest-skin","materialSlotIds":["sc01_door_armrest_skin"],"selectors":[{"targetNode":"InteriorMesh","sourceMaterialId":"SRC_DOOR_ARMREST_SKIN","faceRanges":["100:109"]}]},
    {"surfaceId":"storage-soft-bag","materialSlotIds":["sc01_storage_soft_bag"],"selectors":[{"targetNode":"InteriorMesh","sourceMaterialId":"SRC_STORAGE_SOFT_BAG","faceRanges":["170:179"]}]},
    {"surfaceId":"console-armrest-cover","materialSlotIds":["sc01_console_armrest_cover"],"selectors":[{"targetNode":"InteriorMesh","sourceMaterialId":"SRC_CONSOLE_ARMREST_COVER","faceRanges":["180:189"]}]},
    {"surfaceId":"console-armrest-side","materialSlotIds":["sc01_console_armrest_side"],"selectors":[{"targetNode":"InteriorMesh","sourceMaterialId":"SRC_CONSOLE_ARMREST_SIDE","faceRanges":["190:199"]}]},
    {"surfaceId":"handbrake","materialSlotIds":["sc01_handbrake"],"selectors":[{"targetNode":"InteriorMesh","sourceMaterialId":"SRC_HANDBRAKE","faceRanges":["200:209"]}]},
    {"surfaceId":"roof-surface","materialSlotIds":["sc01_roof_surface"],"selectors":[{"targetNode":"InteriorMesh","sourceMaterialId":"SRC_ROOF_SURFACE","faceRanges":["210:219"]}]},
    {"surfaceId":"lower-skirt","materialSlotIds":["sc01_lower_skirt"],"selectors":[{"targetNode":"UnderbodyMesh","sourceMaterialId":"SRC_LOWER_SKIRT","faceRanges":["*"]}]},
    {"surfaceId":"interior-painted-parts","materialSlotIds":["sc01_interior_painted_parts"],"selectors":[{"targetNode":"InteriorMesh","sourceMaterialId":"SRC_INTERIOR_PAINTED_PARTS","faceRanges":["230:239"]}]},
    {"surfaceId":"door-sill","materialSlotIds":["sc01_door_sill"],"selectors":[{"targetNode":"InteriorMesh","sourceMaterialId":"SRC_DOOR_SILL","faceRanges":["240:249"]}]},
    {"surfaceId":"embroidered-logo","materialSlotIds":["sc01_embroidered_logo"],"selectors":[{"targetNode":"InteriorMesh","sourceMaterialId":"SRC_EMBROIDERED_LOGO","faceRanges":["250:259"]}]},
    {"surfaceId":"center-panel-trim","materialSlotIds":["sc01_center_panel_trim"],"selectors":[{"targetNode":"InteriorMesh","sourceMaterialId":"SRC_CENTER_PANEL_TRIM","faceRanges":["260:269"]}]},
    {"surfaceId":"shift-knob","materialSlotIds":["sc01_shift_knob"],"selectors":[{"targetNode":"InteriorMesh","sourceMaterialId":"SRC_SHIFT_KNOB","faceRanges":["270:279"]}]},
    {"surfaceId":"brake-handle","materialSlotIds":["sc01_brake_handle"],"selectors":[{"targetNode":"InteriorMesh","sourceMaterialId":"SRC_BRAKE_HANDLE","faceRanges":["280:289"]}]},
    {"surfaceId":"pedal","materialSlotIds":["sc01_pedal"],"selectors":[{"targetNode":"InteriorMesh","sourceMaterialId":"SRC_PEDAL","faceRanges":["290:299"]}]}
  ],
  "unsupportedSurfaceIds": []
}
